[
  {
    "memory_id": "staged-ea9aaa18-b62c-4215-9140-463fbb5adba4",
    "layer": "staged",
    "memory_type": "task",
    "source_kind": "dialogue",
    "source_surface": "host_runtime_actions",
    "source_ref": "voice-clip-101",
    "user_ownership": "explicit",
    "confidence": 0.95,
    "status": "active",
    "created_at": "2026-04-23T19:14:37.906Z",
    "updated_at": "2026-04-23T19:14:37.906Z",
    "owner_surface": "host_runtime_actions",
    "invocation_area": "explicit_memory_save_action",
    "route_key": "manualMemoryWrite",
    "sensitivity": "ordinary",
    "anchor_turns": [
      {
        "role": "user",
        "text": "voice transcript: save the unresolved budget note for later"
      }
    ],
    "expires_at": "2026-04-24T07:14:37.906Z",
    "continuity_value": "voice transcript: save the unresolved budget note for later",
    "latest_user_owned_clause": "voice transcript: save the unresolved budget note for later"
  }
]