[
  {
    "memory_id": "long_term_personalization-0cd193a4-8f78-4ac5-a504-399020b52fcd",
    "layer": "long_term_personalization",
    "memory_type": "profile",
    "source_kind": "onboarding",
    "source_surface": "cmcp_setup",
    "source_ref": "mock-host-onboarding-1",
    "user_ownership": "explicit",
    "confidence": 0.95,
    "status": "active",
    "created_at": "2026-04-23T19:14:37.745Z",
    "updated_at": "2026-04-23T19:14:37.745Z",
    "owner_surface": "cmcp_setup",
    "invocation_area": "onboarding_disclosed_profile_capture",
    "route_key": "onboardingProfileCapture",
    "sensitivity": "restricted",
    "field_key": "timezone",
    "personalization_type": "timezone",
    "stored_value": "UTC+8",
    "latest_user_owned_clause": "",
    "stability_basis": "explicit_onboarding_answer"
  }
]