[
  {
    "memory_id": "daily-479769b5-356f-4232-993e-fbae0e79d56e",
    "layer": "daily_memory",
    "memory_type": "task",
    "source_kind": "system_writeback",
    "source_surface": "cmcp_guard",
    "source_ref": "tracked-a4a31980-4a4b-4ce3-9b05-cd4f7a13f39f",
    "user_ownership": "explicit",
    "confidence": 1,
    "status": "active",
    "created_at": "2026-04-23T19:14:37.743Z",
    "updated_at": "2026-04-23T19:14:37.743Z",
    "owner_surface": "cmcp_guard",
    "invocation_area": "explicit_followup_action",
    "route_key": "manualMemoryWrite",
    "sensitivity": "ordinary",
    "derived_from": "tracked-a4a31980-4a4b-4ce3-9b05-cd4f7a13f39f",
    "change_type": "created",
    "latest_user_owned_clause": "send the final CMCP verification package tomorrow morning",
    "anchor_turns": [
      {
        "role": "user",
        "text": "send the final CMCP verification package tomorrow morning"
      }
    ]
  },
  {
    "memory_id": "daily-aa0383c0-0a78-4887-b710-85974bbc93c2",
    "layer": "daily_memory",
    "memory_type": "profile",
    "source_kind": "system_writeback",
    "source_surface": "cmcp_guard",
    "source_ref": "long_term_personalization-0cd193a4-8f78-4ac5-a504-399020b52fcd",
    "user_ownership": "explicit",
    "confidence": 1,
    "status": "active",
    "created_at": "2026-04-23T19:14:37.745Z",
    "updated_at": "2026-04-23T19:14:37.745Z",
    "owner_surface": "cmcp_guard",
    "invocation_area": "onboarding_disclosed_profile_capture",
    "route_key": "onboardingProfileCapture",
    "sensitivity": "restricted",
    "derived_from": "long_term_personalization-0cd193a4-8f78-4ac5-a504-399020b52fcd",
    "change_type": "created",
    "latest_user_owned_clause": "",
    "anchor_turns": []
  }
]